{
  "$schema": "https://recomp.fyi/schema/v1.json",
  "game": "Ford Racing 2",
  "system": "PS2",
  "type": "decomp",
  "original": {
    "region": "PAL",
    "serial": "SLES-517.05"
  },
  "project": "Ford Racing 2 reverse engineering",
  "status": "in-progress",
  "toolchain": "Sony/Cygnus GNU ee-gcc (exact version unresolved)",
  "maintainers": [
    {
      "name": "nicolas-found42",
      "link": "https://github.com/nicolas-found42"
    }
  ],
  "links": [
    {
      "label": "Repository",
      "url": "https://github.com/nicolas-found42/reverse-engineering"
    }
  ],
  "notes": "Static evidence and hand-written reconstruction. Original compiler/linker identity and full game/SDK ownership remain unresolved; no game-wide match percentage is claimed."
}
